question,title,document
What are labels used for in Kubernetes?,Label,b021df6a
How are labels structured in Kubernetes?,Label,b021df6a
What is the role of key/value pairs in labeling objects?,Label,b021df6a
Why might users find labels meaningful and relevant?,Label,b021df6a
Which Kubernetes objects can have labels attached to them?,Label,b021df6a
What is the purpose of a check that runs periodically on a container in a pod?,Probe,76d16796
How does the check influence the lifecycle of a container?,Probe,76d16796
Where can you find more detailed information about container probes?,Probe,76d16796
What is the primary purpose of a LimitRange in Kubernetes?,LimitRange,0ad333e2
How does a LimitRange help manage resources within a namespace?,LimitRange,0ad333e2
In what ways can a LimitRange restrict resources for containers or Pods?,LimitRange,0ad333e2
Can a LimitRange affect the number of certain resource types created?,LimitRange,0ad333e2
What is the purpose of the device classes defined by device drivers and cluster admins in Kubernetes?,Dynamic Resource Allocation,6a399164
How does Kubernetes handle allocation of devices to specific claims?,Dynamic Resource Allocation,6a399164
What role do hardware accelerators play in Kubernetes resource sharing among Pods?,Dynamic Resource Allocation,6a399164
What are some ways a platform developer can add new functionalities to their Kubernetes instance?,Platform Developer,dc1d4e05
How might platform developers contribute to the broader Kubernetes community?,Platform Developer,dc1d4e05
Can platform developers create extensions that are not shared publicly?,Platform Developer,dc1d4e05
What role does a reviewer play in maintaining the quality of the codebase?,Reviewer,8e58cd87
What qualifications or knowledge does a reviewer need to have?,Reviewer,8e58cd87
Is a reviewer's responsibility limited to the entire codebase or specific parts?,Reviewer,8e58cd87
Why might the scope of a reviewer be limited to just a part of the codebase?,Reviewer,8e58cd87
How do reviewers contribute to the software development process?,Reviewer,8e58cd87
What is the purpose of CustomResourceDefinitions in Kubernetes?,CustomResourceDefinition,99bc4b85
How do CustomResourceDefinitions help if the built-in Kubernetes functionality is insufficient?,CustomResourceDefinition,99bc4b85
Do CustomResourceDefinitions require building a new custom server to extend the Kubernetes API?,CustomResourceDefinition,99bc4b85
What does the term 'upstream' mean in the context of the Kubernetes Community?,Upstream (disambiguation),e21cb987
How is the term 'upstream' used differently in GitHub or git compared to the Kubernetes Community?,Upstream (disambiguation),e21cb987
Why might a community member want to move a feature upstream in Kubernetes?,Upstream (disambiguation),e21cb987
"In git terminology, what is the relationship between an upstream and a downstream repository?",Upstream (disambiguation),e21cb987
What does the Kubernetes Community mean by referring to other code or tools relying on the core Kubernetes codebase?,Upstream (disambiguation),e21cb987
What was the purpose of the extension API mentioned in the Kubernetes documentation?,Service Catalog,0bcfa281
How did the extension API assist with using external managed software offerings?,Service Catalog,0bcfa281
What kind of services could Kubernetes clusters connect with using the extension API?,Service Catalog,0bcfa281
What role do admission controllers play when a request is made to the Kubernetes API server?,Admission Controller,0becb50d
How do mutating admission controllers differ from validating admission controllers?,Admission Controller,0becb50d
Is it possible for an admission controller to both modify and reject a request in Kubernetes?,Admission Controller,0becb50d
What type of admission controller has the ability to modify objects before they are stored?,Admission Controller,0becb50d
Can a validating admission controller change the objects they process in Kubernetes?,Admission Controller,0becb50d
What are some examples of day-to-day operations involved in managing a Kubernetes cluster?,Cluster Operations,3786473d
How can a cluster be scaled by adding resources?,Cluster Operations,3786473d
What types of activities are involved in configuring cluster networking?,Cluster Operations,3786473d
Why is implementing security controls important in Kubernetes cluster management?,Cluster Operations,3786473d
What does managing cluster-wide observability entail in the context of Kubernetes?,Cluster Operations,3786473d
What is the purpose of defining claims storage in Kubernetes?,Persistent Volume Claim,34171d17
What are the different ways storage can be accessed in Kubernetes?,Persistent Volume Claim,34171d17
How is storage reclaimed in Kubernetes once it is no longer needed?,Persistent Volume Claim,34171d17
In what Kubernetes object are the specifics of the storage described?,Persistent Volume Claim,34171d17
How is the storage claim used in relation to a volume in Kubernetes?,Persistent Volume Claim,34171d17
What are some specific ways a person can contribute to the Kubernetes project or community?,Contributor,23d21ad4
Does contributing to the Kubernetes project only involve donating code?,Contributor,23d21ad4
"Besides code contributions, what are other forms of participation in the Kubernetes community?",Contributor,23d21ad4
Can organizing events be considered a form of contribution to the Kubernetes project?,Contributor,23d21ad4
How can someone provide feedback as a contribution to the Kubernetes project?,Contributor,23d21ad4
What is an endpoint in the context of a Kubernetes Service?,Endpoints,b8724da7
How does the EndpointSlice controller function when a Service has a selector?,Endpoints,b8724da7
How can EndpointSlices be used for Services that do not have a selector?,Endpoints,b8724da7
"What defines immutable infrastructure, and why can't it be changed after deployment?",Immutable Infrastructure,8e9db3d1
How does immutability help in identifying and mitigating security risks?,Immutable Infrastructure,8e9db3d1
What role does automation play in enforcing immutability within an infrastructure?,Immutable Infrastructure,8e9db3d1
How are containers an example of immutable infrastructure?,Immutable Infrastructure,8e9db3d1
What is the relationship between immutable infrastructure and infrastructure as code?,Immutable Infrastructure,8e9db3d1
What are the possible ways to consume a ConfigMap in Kubernetes?,ConfigMap,a941f8ad
How does a ConfigMap help in making applications portable?,ConfigMap,a941f8ad
What kind of data is stored in a ConfigMap?,ConfigMap,a941f8ad
What is the purpose of extensions in Kubernetes?,Extensions,5e2f5f3c
Why might many Kubernetes users not need to install extensions themselves?,Extensions,5e2f5f3c
Do most Kubernetes users need to create their own extensions?,Extensions,5e2f5f3c
What is the role of etcd in a Kubernetes cluster?,etcd,a226e9fb
Why is it important to have a backup plan in place for etcd?,etcd,a226e9fb
Where can I find more detailed information about etcd?,etcd,a226e9fb
What is the purpose of using HostAliases in Kubernetes?,HostAliases,f47b1769
When are HostAliases applied to a Pod's hosts file?,HostAliases,f47b1769
Can HostAliases be used with hostNetwork Pods?,HostAliases,f47b1769
Where can you find more information about the HostAliases feature in Kubernetes?,HostAliases,f47b1769
Is it mandatory to specify HostAliases for a Pod?,HostAliases,f47b1769
What is the main purpose of CNI plugins in Kubernetes?,Container network interface (CNI),b2ceaf1b
What specification do CNI plugins follow?,Container network interface (CNI),b2ceaf1b
Where can more information about Kubernetes and CNI be found in the documentation?,Container network interface (CNI),b2ceaf1b
What is the primary purpose of a sidecar container in Kubernetes?,Sidecar Container,ae45514e
How do sidecar containers differ from regular app containers in terms of their lifecycle?,Sidecar Container,ae45514e
Where can I find more detailed information about sidecar containers in Kubernetes?,Sidecar Container,ae45514e
What role do DeviceClasses play in dynamic resource allocation within a Kubernetes cluster?,DeviceClass,3d398179
Who is responsible for defining DeviceClasses in a Kubernetes environment?,DeviceClass,3d398179
How are devices claimed in a workload using DeviceClasses?,DeviceClass,3d398179
Where can one find more information about Dynamic Resource Allocation related to DeviceClasses?,DeviceClass,3d398179
What is the role of the API server in Kubernetes?,API server,263d5008
How does the Kubernetes API server scale to handle increased demand?,API server,263d5008
What is kube-apiserver and where can its main implementation be found?,API server,263d5008
How can traffic be managed when multiple instances of kube-apiserver are deployed?,API server,263d5008
What component acts as the front end for the Kubernetes control plane?,API server,263d5008
What happens to a Kubernetes volume when a container within the pod restarts?,Volume,bd7a9717
How long does a Kubernetes volume exist in relation to the pod that contains it?,Volume,bd7a9717
Where can one find more details about Kubernetes storage concepts?,Volume,bd7a9717
What is the purpose of ResourceClaims in Kubernetes?,ResourceClaim,d5f30667
How do ResourceClaims facilitate dynamic resource allocation (DRA) for Pods?,ResourceClaim,d5f30667
Who can create ResourceClaims in a Kubernetes environment?,ResourceClaim,d5f30667
What is node-pressure eviction and how does it help manage resources on a Kubernetes node?,Node-pressure eviction,fecb13f1
Which resources does the kubelet monitor to trigger node-pressure eviction?,Node-pressure eviction,fecb13f1
How does node-pressure eviction differ from API-initiated eviction in Kubernetes?,Node-pressure eviction,fecb13f1
What actions does the kubelet take when resource consumption reaches critical levels on a node?,Node-pressure eviction,fecb13f1
Why is node-pressure eviction important for preventing resource starvation in a Kubernetes cluster?,Node-pressure eviction,fecb13f1
What role does preemption play in scheduling pending Pods?,Preemption,b7144de2
How does Kubernetes decide which Pods to evict when using preemption?,Preemption,b7144de2
What happens if a Pod cannot initially be scheduled on any Node?,Preemption,b7144de2
What is a container in the context of Kubernetes?,Container,0e7278cd
How do containers simplify application deployment across various environments?,Container,0e7278cd
What is the term used for applications running inside containers?,Container,0e7278cd
What does the process of containerization involve?,Container,0e7278cd
Why are containers considered lightweight and portable?,Container,0e7278cd
What is the minimum number of worker nodes required in a Kubernetes cluster?,Cluster,249694a4
What role do worker nodes play in managing application workloads?,Cluster,249694a4
How does the control plane contribute to fault-tolerance and high availability in a Kubernetes cluster?,Cluster,249694a4
What is the purpose of the aggregation layer in a Kubernetes cluster?,Aggregation Layer,ee043734
How can you extend your Kubernetes cluster to include additional APIs?,Aggregation Layer,ee043734
What is an `APIService` object used for in relation to the aggregation layer?,Aggregation Layer,ee043734
What does the legacy term 'hosting the' refer to in Kubernetes documentation?,Master,f03bde11
How is the legacy term still being used by provisioning tools and managed services?,Master,f03bde11
What role does the 'kubernetes.io/role' label play in the usage of the legacy term?,Master,f03bde11
What roles does a person involved in developing Kubernetes typically undertake?,Code Contributor,5f8b6080
Is contributing code the only way a developer can participate in the Kubernetes community?,Code Contributor,5f8b6080
What does it mean to be an active participant in the Kubernetes ecosystem?,Code Contributor,5f8b6080
What is the purpose of compiling separate processes into a single binary in Kubernetes?,kube-controller-manager,63c0a62f
Why is it beneficial to run multiple processes as a single process in the control plane component?,kube-controller-manager,63c0a62f
How does running processes as a single binary affect the complexity of Kubernetes components?,kube-controller-manager,63c0a62f
What is the purpose of CRI-O within the Kubernetes ecosystem?,CRI-O,b06f5d40
How does CRI-O enable Kubernetes to interact with container runtimes?,CRI-O,b06f5d40
"Can CRI-O work with container images from remote sources, and if so, how?",CRI-O,b06f5d40
What specification must the container runtimes adhere to for compatibility with CRI-O?,CRI-O,b06f5d40
Why might someone choose CRI-O when deploying Kubernetes?,CRI-O,b06f5d40
What are some examples of sensitive information that can be managed by Kubernetes Secrets?,Secret,1e6947ac
How are Secret values encoded and stored by default in Kubernetes?,Secret,1e6947ac
What are the methods a Pod can utilize to access a Secret in Kubernetes?,Secret,1e6947ac
What is the main difference between Secrets and ConfigMaps in terms of data confidentiality?,Secret,1e6947ac
What configuration change can be applied to enhance the security of stored Secrets in Kubernetes?,Secret,1e6947ac
What is the purpose of the Kubernetes downward API in relation to containers?,Downward API,b3a7464b
Why might a container need information about itself without directly accessing the Kubernetes API?,Downward API,b3a7464b
What are the two methods used by Kubernetes to provide Pod and container field values to containers?,Downward API,b3a7464b
How does the downward API help applications running in containers with accessing their context within a Kubernetes cluster?,Downward API,b3a7464b
Why is it beneficial for applications in containers to access field values without acting as a Kubernetes API client?,Downward API,b3a7464b
What role does the CNCF play in relation to container orchestration projects?,Cloud Native Computing Foundation (CNCF),4c9a5c67
How is Kubernetes related to the CNCF?,Cloud Native Computing Foundation (CNCF),4c9a5c67
What is the main goal of the CNCF?,Cloud Native Computing Foundation (CNCF),4c9a5c67
Under which larger organization does the CNCF operate?,Cloud Native Computing Foundation (CNCF),4c9a5c67
What is the connection between CNCF projects and microservices architecture?,Cloud Native Computing Foundation (CNCF),4c9a5c67
What is the role of an architect in the design of an application?,Application Architect,7f69215e
How does an architect ensure the scalability and maintainability of an application?,Application Architect,7f69215e
What are some examples of surrounding components an application must interact with?,Application Architect,7f69215e
Why is it important for an app's implementation to interact effectively with its surrounding components?,Application Architect,7f69215e
What aspects of application design does an architect focus on?,Application Architect,7f69215e
"What are the main cloud providers currently supported by kOps, and what are their support statuses?",kOps (Kubernetes Operations),1c93756c
How does kOps handle system failures within a Kubernetes cluster?,kOps (Kubernetes Operations),1c93756c
What role does DNS play in the functioning of kOps when managing Kubernetes clusters?,kOps (Kubernetes Operations),1c93756c
What are the operating systems that kOps supports for its Kubernetes installations?,kOps (Kubernetes Operations),1c93756c
In what ways can kOps set up the cloud infrastructure necessary for a Kubernetes cluster?,kOps (Kubernetes Operations),1c93756c
What are container environment variables in Kubernetes and what do they provide to running containers?,Container Environment Variables,c4e93a4e
What kind of information can container environment variables include for containerized applications?,Container Environment Variables,c4e93a4e
How do container environment variables relate to other cluster resources such as service endpoints in Kubernetes?,Container Environment Variables,c4e93a4e
What does the term 'downstream' refer to in the context of the Kubernetes Community?,Downstream (disambiguation),9d828e3a
How is the term 'downstream' used differently in GitHub or git compared to the Kubernetes Community?,Downstream (disambiguation),9d828e3a
What does it mean for an application to adopt a new feature 'downstream' in Kubernetes?,Downstream (disambiguation),9d828e3a
What is the relationship between upstream and downstream repositories in git conventions?,Downstream (disambiguation),9d828e3a
What is the purpose of NetworkPolicies in Kubernetes?,Network Policy,bc2fdfa2
How do NetworkPolicies define which Pods can communicate with each other?,Network Policy,bc2fdfa2
What components are necessary for a NetworkPolicy to be effective in controlling network traffic?,Network Policy,bc2fdfa2
What role do network plugins play in the implementation of NetworkPolicies?,Network Policy,bc2fdfa2
Can NetworkPolicies be used to specify communication rules across different namespaces?,Network Policy,bc2fdfa2
What is the purpose of Pod Priority in Kubernetes?,Pod Priority,6a3918c8
How does Pod Priority impact the scheduling of Pods in a cluster?,Pod Priority,6a3918c8
Why is Pod Priority considered important for workloads in production clusters?,Pod Priority,6a3918c8
What is the purpose of allowing a kube-apiserver to proxy resource requests to a different peer API server?,Mixed Version Proxy (MVP),56e11537
How does this feature benefit clusters with multiple API servers running different Kubernetes versions?,Mixed Version Proxy (MVP),56e11537
What must be done to activate the feature that allows the kube-apiserver to proxy requests?,Mixed Version Proxy (MVP),56e11537
Which feature gate needs to be enabled to use the kube-apiserver proxy feature?,Mixed Version Proxy (MVP),56e11537
Is the kube-apiserver proxy feature enabled by default in Kubernetes?,Mixed Version Proxy (MVP),56e11537
What does a stored instance of software contain that's necessary for running an application?,Image,be53a054
How is software packaged for storage and execution in a container within Kubernetes?,Image,be53a054
What type of information is included in the metadata of a container image?,Image,be53a054
Where can software packaged as a container be stored before it is pulled to a local system?,Image,be53a054
What kind of information does the metadata in a container image provide about the executable and its creator?,Image,be53a054
What is a disruption in Kubernetes and what is its impact on workload management?,Disruption,f98c6e23
How does Kubernetes define a voluntary disruption?,Disruption,f98c6e23
What is considered an involuntary disruption in Kubernetes?,Disruption,f98c6e23
What are some potential causes of involuntary disruptions in a Kubernetes cluster?,Disruption,f98c6e23
Where can I find more information about disruptions in Kubernetes?,Disruption,f98c6e23
What are device plugins used for in Kubernetes?,Device Plugin,a68d46fa
How do device plugins inform about available resources?,Device Plugin,a68d46fa
What are the methods to deploy a device plugin in Kubernetes?,Device Plugin,a68d46fa
Why might a device plugin require vendor-specific initialization?,Device Plugin,a68d46fa
Where can you find more detailed information on device plugins?,Device Plugin,a68d46fa
What is the main problem with using a simple hash-based scheme for assigning requests to queues?,Shuffle-sharding,f206f583
How does shuffle-sharding improve insulation between low-intensity and high-intensity request flows?,Shuffle-sharding,f206f583
"What metaphor is used to explain the shuffle-sharding technique, and how does it apply to queue selection?",Shuffle-sharding,f206f583
Why is the choice of hand size important in the shuffle-sharding technique?,Shuffle-sharding,f206f583
What characteristics of a request are typically used in a hash function to determine the queue index in a simple hash-based scheme?,Shuffle-sharding,f206f583
What are the three required properties of a core object in Kubernetes?,Toleration,e6f4d685
How do tolerations affect pod scheduling on nodes?,Toleration,e6f4d685
Can a pod with a specific toleration be scheduled on a node without a matching property?,Toleration,e6f4d685
What role do tolerations play in preventing pods from being scheduled on unsuitable nodes?,Toleration,e6f4d685
Is it necessary for a pod to be scheduled on a node if its toleration matches the node's properties?,Toleration,e6f4d685
What is the purpose of a UID in Kubernetes?,UID,e7d22294
How does Kubernetes ensure each object has a unique identity?,UID,e7d22294
Why is it important for every object in a Kubernetes cluster to have a distinct UID?,UID,e7d22294
Can UIDs help in distinguishing between similar entities over time in Kubernetes?,UID,e7d22294
What role does a UID play in managing the lifecycle of objects in a Kubernetes cluster?,UID,e7d22294
What are the two types of pod disruptions mentioned in Kubernetes?,Pod Disruption,3ea414e1
Who typically initiates voluntary pod disruptions?,Pod Disruption,3ea414e1
What are some causes of involuntary pod disruptions in Kubernetes?,Pod Disruption,3ea414e1
What is the primary function of a HorizontalPodAutoscaler (HPA) in Kubernetes?,Horizontal Pod Autoscaler,5b2c1651
To what types of Kubernetes objects can HorizontalPodAutoscaler be applied?,Horizontal Pod Autoscaler,5b2c1651
Why might a HorizontalPodAutoscaler not be suitable for certain Kubernetes objects?,Horizontal Pod Autoscaler,5b2c1651
What is the difference between Infrastructure as a Service (IaaS) and Platform as a Service (PaaS) in the context of cloud providers?,Cloud Provider,d8613296
What responsibilities does a cloud provider take on when offering a managed infrastructure service?,Cloud Provider,d8613296
"In a managed Kubernetes service, what components is the cloud provider responsible for overseeing?",Cloud Provider,d8613296
How does the role of a cloud provider change when offering Kubernetes as a managed service compared to a managed infrastructure service?,Cloud Provider,d8613296
What elements besides networking and storage might a cloud provider manage in a Platform as a Service offering?,Cloud Provider,d8613296
What type of interface does the Kubernetes application use to serve functionality and store the state of the cluster?,Kubernetes API,da0a2841
"In what format are Kubernetes resources and records of intent stored, and how can they be modified?",Kubernetes API,da0a2841
What does configuring Kubernetes through the API in a declarative way allow users to do?,Kubernetes API,da0a2841
"Besides direct interaction, what tool can users use to interact with the Kubernetes API?",Kubernetes API,da0a2841
How can the core Kubernetes API be extended?,Kubernetes API,da0a2841
What are the main responsibilities of a cluster operator in Kubernetes?,Cluster Operator,9aaf2d0a
How does a cluster operator's role differ from the Operator pattern in Kubernetes?,Cluster Operator,9aaf2d0a
What tasks might a cluster operator perform to ensure a cluster remains operational?,Cluster Operator,9aaf2d0a
What is the role of the container orchestration layer in Kubernetes?,Control Plane,7fd622e2
What forms can the components of the orchestration layer take when running on a host?,Control Plane,7fd622e2
How were the hosts running the orchestration layer components historically referred to?,Control Plane,7fd622e2
What is the primary role of kube-proxy in a Kubernetes cluster?,kube-proxy,ea11065c
How does kube-proxy facilitate communication to Pods within the cluster?,kube-proxy,ea11065c
What mechanism does kube-proxy use if the operating system packet filtering layer is unavailable?,kube-proxy,ea11065c
Does kube-proxy work with both internal and external network sessions?,kube-proxy,ea11065c
Where can I find more detailed information about kube-proxy's command-line tools?,kube-proxy,ea11065c
What is a JWT and why is it used in Kubernetes?,JSON Web Token (JWT),87b6269f
How does Kubernetes utilize JWTs for authentication?,JSON Web Token (JWT),87b6269f
Can JWTs be encrypted as well as digitally signed in Kubernetes?,JSON Web Token (JWT),87b6269f
What actions can the kubectl command line tool perform on Kubernetes objects?,Kubectl,6f49e891
How is the term 'kubectl' officially pronounced?,Kubectl,6f49e891
What does the kubectl tool use to interact with a Kubernetes cluster?,Kubectl,6f49e891
What are the different phases that a Pod can go through during its lifecycle?,Pod Lifecycle,7641016e
How is the current state of a Pod described in Kubernetes?,Pod Lifecycle,7641016e
Where can one find a high-level summary of a Pod's state?,Pod Lifecycle,7641016e
Why might a Pod's state be described as 'Unknown'?,Pod Lifecycle,7641016e
What is the significance of the PodStatus 'phase' field in Kubernetes?,Pod Lifecycle,7641016e
What is the purpose of a CronJob in Kubernetes?,CronJob,63912595
How does a CronJob determine when to execute a task?,CronJob,63912595
What format does a CronJob use to specify its schedule?,CronJob,63912595
In what way is a CronJob similar to a crontab file?,CronJob,63912595
Where can I find additional information about how a Job functions within Kubernetes?,CronJob,63912595
How are fractional numbers represented using SI suffixes in Kubernetes?,Quantity,694e8d1f
What is the representation of the number 1000 using SI suffixes?,Quantity,694e8d1f
Which units are considered power-of-10 and how are they represented?,Quantity,694e8d1f
What is the equivalent of the binary number 2048 using binary-notation suffixes?,Quantity,694e8d1f
How does the `k` in kilo differ in case compared to other SI units in Kubernetes?,Quantity,694e8d1f
What is the primary focus of an application developer in a Kubernetes cluster?,Application Developer,a83c0397
How might the scale of an application developer's focus in a Kubernetes cluster differ?,Application Developer,a83c0397
