question,title,document
What is the purpose of creating an ExternalName service in Kubernetes?,kubectl create service externalname,950f6633
How does an ExternalName service differ from a regular service in Kubernetes?,kubectl create service externalname,950f6633
What command would you use to create an ExternalName service named 'my-ns' that points to 'bar.com'?,kubectl create service externalname,950f6633
What do the options --dry-run=server|client|none specify when creating an ExternalName service?,kubectl create service externalname,950f6633
What is an example of when you might use an ExternalName service in Kubernetes?,kubectl create service externalname,950f6633
What is the purpose of a docker-registry type secret in Kubernetes?,kubectl create secret,d71a7259
How is a generic type secret referred to in Kubernetes terminology?,kubectl create secret,d71a7259
What does a tls type secret contain in Kubernetes?,kubectl create secret,d71a7259
What is the purpose of the '--value' option when creating a priority class?,kubectl create priorityclass,7b55dce5
How would you set a priority class as the global default priority?,kubectl create priorityclass,7b55dce5
What does the '--preemption-policy' option do when creating a priority class?,kubectl create priorityclass,7b55dce5
How can you specify a dry run when creating a priority class?,kubectl create priorityclass,7b55dce5
"Can two priority classes have the same value, and what happens if they do?",kubectl create priorityclass,7b55dce5
What is the purpose of a pod disruption budget in Kubernetes?,kubectl create poddisruptionbudget,29a13236
How do you specify which pods a disruption budget applies to?,kubectl create poddisruptionbudget,29a13236
What does the '--min-available' option define when creating a pod disruption budget?,kubectl create poddisruptionbudget,29a13236
What would happen if the specified number or percentage of available pods is not met according to the pod disruption budget?,kubectl create poddisruptionbudget,29a13236
How can you create a pod disruption budget for an app with a specific label?,kubectl create poddisruptionbudget,29a13236
What is the default behavior for the key and value when creating a config map from a file?,kubectl create configmap,a7ff9e0c
How does Kubernetes handle directory entries that are not regular files when creating a config map from a directory?,kubectl create configmap,a7ff9e0c
Can you specify custom keys instead of using the file basenames when creating a config map from files?,kubectl create configmap,a7ff9e0c
How can you create a config map using literal key-value pairs?,kubectl create configmap,a7ff9e0c
What command can you use to create a config map from environment variable files?,kubectl create configmap,a7ff9e0c
What is the general command syntax for creating a service in Kubernetes using the specified subcommand?,kubectl create service,8ef67423
How can you ensure the output of a service creation is in JSON format?,kubectl create service,8ef67423
What is the role of flags when using the kubectl create service command?,kubectl create service,8ef67423
What is the purpose of the 'kubectl create clusterrolebinding' command in Kubernetes?,kubectl create clusterrolebinding,42a027ab
How can a user create a cluster role binding for multiple users and a group using the cluster-admin role?,kubectl create clusterrolebinding,42a027ab
What does the '--dry-run' option do in the 'kubectl create clusterrolebinding' command?,kubectl create clusterrolebinding,42a027ab
What is the default behavior for naming the key when creating a secret from a file?,kubectl create secret generic,e6e242de
How does Kubernetes handle directory entries that are not regular files when creating a secret from a directory?,kubectl create secret generic,e6e242de
"Can you specify custom keys when creating a secret from files, and if so, how?",kubectl create secret generic,e6e242de
What is the purpose of the '--dry-run' option in the 'kubectl create secret' command?,kubectl create secret generic,e6e242de
How can you create a Kubernetes secret using a combination of files and literal values?,kubectl create secret generic,e6e242de
What command would you use to set hard limits on resources like CPU and memory for a new quota named 'my-quota'?,kubectl create quota,f1163f14
How can you specify scopes when creating a resource quota in Kubernetes?,kubectl create quota,f1163f14
What is the purpose of the '--dry-run' option in the 'kubectl create quota' command?,kubectl create quota,f1163f14
How would you create a resource quota with a specific scope of 'BestEffort' for a  'best-effort' quota?,kubectl create quota,f1163f14
What are some of the resources you can set limits on when creating a resource quota in Kubernetes?,kubectl create quota,f1163f14
What prerequisites are needed before creating a TLS secret using a public/private key pair?,kubectl create secret tls,cc3bf0be
What file format should the public key certificate be encoded in when creating a TLS secret?,kubectl create secret tls,cc3bf0be
How do you create a TLS secret named 'tls-secret' using kubectl?,kubectl create secret tls,cc3bf0be
What is the purpose of the '--dry-run' option in the 'kubectl create secret' command?,kubectl create secret tls,cc3bf0be
What paths should be specified in the kubectl command to create a TLS secret?,kubectl create secret tls,cc3bf0be
What is the purpose of specifying a schedule in the cron job command?,kubectl create cronjob,9a989473
How can you create a cron job with a specific command to execute?,kubectl create cronjob,9a989473
What is the function of the image parameter when creating a cron job?,kubectl create cronjob,9a989473
How often will a cron job scheduled with '*/1 * * * *' execute?,kubectl create cronjob,9a989473
What does the '--' signify in the cron job creation command?,kubectl create cronjob,9a989473
What is the basic command structure to create a job in Kubernetes?,kubectl create job,15a5b01e
How can you specify an image for the job you are creating?,kubectl create job,15a5b01e
What command would you use if you want to create a job based on an existing cron job?,kubectl create job,15a5b01e
"Can you specify a particular command for the job to execute and if so, how?",kubectl create job,15a5b01e
What does the `--from` flag do when creating a job?,kubectl create job,15a5b01e
What is the purpose of the '--tcp' flag when creating a ClusterIP service?,kubectl create service clusterip,d40cfb15
How can you specify a ClusterIP service to run in headless mode?,kubectl create service clusterip,d40cfb15
What does the '--dry-run' option do when creating a service clusterip?,kubectl create service clusterip,d40cfb15
"What command would you use to create a role that allows getting, watching, and listing pods in Kubernetes?",kubectl create role,2ce03fe9
How can you specify multiple resource names for a role in Kubernetes?,kubectl create role,2ce03fe9
How do you create a role in Kubernetes with actions specified for a subresource?,kubectl create role,2ce03fe9
What is the primary purpose of using a role binding in Kubernetes?,kubectl create rolebinding,b2569f93
How can you specify multiple users and groups when creating a role binding?,kubectl create rolebinding,b2569f93
What is the difference between using --role=NAME and --clusterrole=NAME when creating a role binding?,kubectl create rolebinding,b2569f93
How can you create a role binding specifically for a service account in Kubernetes?,kubectl create rolebinding,b2569f93
What is the function of the --dry-run option in the role binding command?,kubectl create rolebinding,b2569f93
What is the purpose of creating a Dockercfg secret in Kubernetes?,kubectl create secret docker-registry,64214de0
How can you authenticate to a Docker registry using the Docker command line?,kubectl create secret docker-registry,64214de0
What information is necessary to create a docker-registry secret using kubectl?,kubectl create secret docker-registry,64214de0
Is the email address mandatory when authenticating to a Docker registry or creating a Docker secret?,kubectl create secret docker-registry,64214de0
How can you create a Kubernetes secret from an existing .docker/config.json file?,kubectl create secret docker-registry,64214de0
What does the command 'kubectl create service nodeport NAME' do in a Kubernetes context?,kubectl create service nodeport,9f6949e2
"In the given example command, what is the significance of '--tcp=5678:8080'?",kubectl create service nodeport,9f6949e2
What is the purpose of using the '--dry-run' option when creating a NodePort service?,kubectl create service nodeport,9f6949e2
What name is given to the new NodePort service in the example provided?,kubectl create service nodeport,9f6949e2
How can you specify a target port when creating a NodePort service using kubectl?,kubectl create service nodeport,9f6949e2
What is the purpose of using 'kubectl create serviceaccount' command in Kubernetes?,kubectl create serviceaccount,8b2d0bc3
How can you create a service account with a specific name in Kubernetes?,kubectl create serviceaccount,8b2d0bc3
What does the '--dry-run' option do when creating a service account in Kubernetes?,kubectl create serviceaccount,8b2d0bc3
Provide an example command to create a service account named 'my-service-account'.,kubectl create serviceaccount,8b2d0bc3
What are the possible values for the '--dry-run' option when creating a service account?,kubectl create serviceaccount,8b2d0bc3
What is the purpose of specifying multiple verbs in the cluster role creation command?,kubectl create clusterrole,809b0671
How can you create a cluster role that allows accessing specific pod resources by name?,kubectl create clusterrole,809b0671
What does specifying a NonResourceURL in the cluster role entail?,kubectl create clusterrole,809b0671
How does specifying an AggregationRule when creating a cluster role affect its functionality?,kubectl create clusterrole,809b0671
What is the significance of specifying an API Group when creating a cluster role?,kubectl create clusterrole,809b0671
What file formats are accepted for creating a resource with kubectl?,kubectl create,d4d4ea5a
How can you create a pod using information from a file?,kubectl create,d4d4ea5a
What command allows you to create a pod using data passed through stdin?,kubectl create,d4d4ea5a
How can you edit a YAML file in JSON format before creating a resource?,kubectl create,d4d4ea5a
What command should I use to display the supported API versions in Kubernetes?,kubectl api-versions,96acd4b2
In what format are the supported API versions displayed when using the appropriate command?,kubectl api-versions,96acd4b2
"Is there a JSON output format available for listing supported API versions, and if so, what is it?",kubectl api-versions,96acd4b2
How can you execute a command in a specific container within a pod?,kubectl exec,f8788db9
What is the purpose of using the '-c' option with 'kubectl exec'?,kubectl exec,f8788db9
How do you use 'kubectl exec' to open an interactive shell in a container?,kubectl exec,f8788db9
What should you be careful about when running a command with flags using 'kubectl exec'?,kubectl exec,f8788db9
How do you execute a command in a pod from a deployment or service using 'kubectl exec'?,kubectl exec,f8788db9
What is the format required for a label key and value when updating a resource in Kubernetes?,kubectl label,53dea42b
How does the --overwrite flag affect the behavior when updating labels on a resource?,kubectl label,53dea42b
What happens if you use the --resource-version flag while updating labels on a resource?,kubectl label,53dea42b
Can you update all pods in a namespace with a specific label in one command? How?,kubectl label,53dea42b
How can you remove a specific label from a pod without using the --overwrite flag?,kubectl label,53dea42b
"What command would you use to list all pods with detailed information, such as the node name, in Kubernetes?",kubectl get,97e3c70d
How can you specify which attributes of a fetched resource should be displayed using a template?,kubectl get,97e3c70d
Which command is used to list all deployments in the 'v1' version of the 'apps' API group in JSON format?,kubectl get,97e3c70d
"If you want to list resources in a specific namespace, how would you include the namespace in the command?",kubectl get,97e3c70d
How can you display the phase value of a specific pod using the kubectl get command?,kubectl get,97e3c70d
What are the different arguments you can specify when deleting resources in Kubernetes?,kubectl delete,3eb43484
"What does the --grace-period flag do when deleting resources, and when might it be ignored?",kubectl delete,3eb43484
"What is the risk of force deleting a pod, especially in relation to shared storage or remote APIs?",kubectl delete,3eb43484
How can you delete resources from a directory containing a kustomization.yaml file?,kubectl delete,3eb43484
What is a potential consequence of deleting a resource if someone else submits an update at the same time?,kubectl delete,3eb43484
What command can you use to view the resource usage of pods in Kubernetes?,kubectl top pod,24d99e73
"If you want to view the resource consumption of a specific pod by its name, what syntax would you use?",kubectl top pod,24d99e73
How can you display metrics for pods that are selected using a specific label?,kubectl top pod,24d99e73
What might cause a delay in the availability of resource usage metrics for newly created pods?,kubectl top pod,24d99e73
How do you view the resource usage metrics for all pods within a specific namespace in Kubernetes?,kubectl top pod,24d99e73
What is the purpose of the 'kubectl top node' command?,kubectl top node,a2652109
How can you display the resource usage for all nodes using kubectl?,kubectl top node,a2652109
What specific information can you view by using 'kubectl top node NODE_NAME'?,kubectl top node,a2652109
What is the primary function of the 'kubectl top' command in Kubernetes?,kubectl top,47158b98
Why might the resource metrics provided by Kubernetes differ from those offered by OS tools like 'top'?,kubectl top,47158b98
What prerequisites must be met for the 'kubectl top' command to operate correctly?,kubectl top,47158b98
In what situations would a Kubernetes user choose to use the 'kubectl top' command?,kubectl top,47158b98
Why is the 'kubectl top' command not suitable for high-accuracy reporting or alerting in Kubernetes environments?,kubectl top,47158b98
What is the purpose of specifying preconditions with the scale command in Kubernetes?,kubectl scale,711c3179
How can you scale a replica set named 'foo' to 3 replicas using kubectl?,kubectl scale,711c3179
What command would you use to scale a Kubernetes resource specified in a file named 'foo.yaml'?,kubectl scale,711c3179
How can you ensure that a deployment is only scaled if its current replica count is a specific number?,kubectl scale,711c3179
"Can you scale multiple replication controllers at once and, if so, how?",kubectl scale,711c3179
What are the components of a taint in Kubernetes and how are they expressed?,kubectl taint,03f1623c
What are the rules for formatting the key and value of a taint?,kubectl taint,03f1623c
What taint effects are allowed in Kubernetes and what do they signify?,kubectl taint,03f1623c
How can a taint be removed from a node if it matches a specific key and effect?,kubectl taint,03f1623c
Can taints be applied to resources other than nodes in Kubernetes?,kubectl taint,03f1623c
How do you perform a rollback to the previous deployment in Kubernetes?,kubectl rollout undo,f5e66daa
"What is the command to roll back a daemonset to a specific revision, such as revision 3?",kubectl rollout undo,f5e66daa
What does the --dry-run=server flag do when performing a rollback on a deployment?,kubectl rollout undo,f5e66daa
What is the effect of resuming a paused resource in Kubernetes?,kubectl rollout resume,78659d0e
Which type of Kubernetes resource supports being resumed after being paused?,kubectl rollout resume,78659d0e
What is the specific kubectl command to resume a paused deployment named 'nginx'?,kubectl rollout resume,78659d0e
What is the purpose of the 'kubectl rollout restart RESOURCE' command?,kubectl rollout restart,28644f68
How can you restart all deployments within a specific namespace using kubectl?,kubectl rollout restart,28644f68
What command would you use to restart a specific deployment named 'nginx'?,kubectl rollout restart,28644f68
How do you restart a daemon set using kubectl?,kubectl rollout restart,28644f68
"How can you restart deployments that have a specific label, such as 'app=nginx'?",kubectl rollout restart,28644f68
What is the purpose of the 'rollout status' command in Kubernetes?,kubectl rollout status,84913dcf
How can you avoid waiting for the rollout to complete using the 'rollout status' command?,kubectl rollout status,84913dcf
What does 'rollout status' do if a new rollout occurs while it's still monitoring the previous one?,kubectl rollout status,84913dcf
How can you watch a specific revision of a rollout and terminate if it gets replaced by another?,kubectl rollout status,84913dcf
What command would you use to check the rollout status of a deployment named 'nginx'?,kubectl rollout status,84913dcf
What does it mean for a Kubernetes resource to be paused?,kubectl rollout pause,a197ed1e
Which resources support the pause functionality in Kubernetes?,kubectl rollout pause,a197ed1e
How can a paused resource be resumed in Kubernetes?,kubectl rollout pause,a197ed1e
Will a paused deployment continue its current operations?,kubectl rollout pause,a197ed1e
What is the effect of updating a paused deployment?,kubectl rollout pause,a197ed1e
What are the valid resource types that can be managed using the rollout command in Kubernetes?,kubectl rollout,e7d7c16b
How can you roll back to a previous deployment using the rollout command?,kubectl rollout,e7d7c16b
What is the kubectl command to check the rollout status of a daemonset called 'foo'?,kubectl rollout,e7d7c16b
How would you restart a specific deployment called 'abc' using the rollout command?,kubectl rollout,e7d7c16b
"If you have multiple deployments labeled 'app=nginx', what is the command to restart all of them using kubectl?",kubectl rollout,e7d7c16b
What command will display the rollout history of a specific deployment in Kubernetes?,kubectl rollout history,cc9da943
How can you view the details for a specific revision of a daemonset?,kubectl rollout history,cc9da943
Which command is used to check the rollout history of Kubernetes resources?,kubectl rollout history,cc9da943
What does the 'kubectl apply set-last-applied -f FILENAME' command do?,kubectl apply set-last-applied,850acdc7
How can you update the last-applied-configuration for multiple files within a directory?,kubectl apply set-last-applied,850acdc7
What happens if the last-applied-configuration annotation does not exist when using 'kubectl apply set-last-applied'?,kubectl apply set-last-applied,850acdc7
What happens if an error occurs while trying to update a resource using the edit-last-applied command?,kubectl apply edit-last-applied,f8072f1c
How can a user specify that the edits should be made in JSON format rather than the default YAML?,kubectl apply edit-last-applied,f8072f1c
What are the steps to take if another editor changes a resource on the server while you are editing it?,kubectl apply edit-last-applied,f8072f1c
What does the --windows-line-endings flag do when using the edit-last-applied command?,kubectl apply edit-last-applied,f8072f1c
How can a user choose which editor to use when running the edit-last-applied command in Kubernetes?,kubectl apply edit-last-applied,f8072f1c
What is the default output format for viewing last-applied-configuration annotations?,kubectl apply view-last-applied,0ed2d5e8
How can you change the output format when viewing last-applied-configuration annotations?,kubectl apply view-last-applied,0ed2d5e8
What command would you use to view the last-applied-configuration annotations for a specific deployment by name?,kubectl apply view-last-applied,0ed2d5e8
How do you view the last-applied-configuration annotations from a file in JSON format?,kubectl apply view-last-applied,0ed2d5e8
What options are available for specifying which annotations to view when using the kubectl apply view-last-applied command?,kubectl apply view-last-applied,0ed2d5e8
What are the file formats accepted for applying configurations to a Kubernetes resource?,kubectl apply,8666ad26
What should you do before using the 'apply' command to ensure the resource is properly configured?,kubectl apply,8666ad26
How can you apply a configuration stored in a specific directory that includes kustomization.yaml?,kubectl apply,8666ad26
"What is the purpose of the --prune flag when applying configurations, and what caution is advised?",kubectl apply,8666ad26
How can you apply a configuration that matches specific labels and delete others that do not match?,kubectl apply,8666ad26
