question,title,document
Who is responsible for writing applications that run within a Kubernetes cluster?,Application Developer,a83c0397
What is dockershim and which versions of Kubernetes include it?,Dockershim,63e6413d
When was dockershim removed from Kubernetes?,Dockershim,63e6413d
Where can I find more information about the removal of dockershim?,Dockershim,63e6413d
What is the purpose of the sysctl interface in Unix-like systems?,sysctl,a2c88367
In what two forms does sysctl exist on Unix-like systems?,sysctl,a2c88367
Why might some runtimes and network plugins depend on specific sysctl values?,sysctl,a2c88367
What types of machines can a Kubernetes worker node be?,Node,6c3a6944
Who manages the worker nodes in a Kubernetes cluster?,Node,6c3a6944
What were nodes called in the early versions of Kubernetes?,Node,6c3a6944
What is the purpose of using a verb in Kubernetes to track changes to an object?,Watch,f2065865
How does 'watch' contribute to detecting changes in Kubernetes?,Watch,f2065865
What is an example of a situation where a watch would be more efficient than polling in Kubernetes?,Watch,f2065865
Where can one find more information about efficient change detection in the Kubernetes API?,Watch,f2065865
What is the purpose of workload management in Kubernetes?,ReplicationController,00d3fcb5
How does the control plane maintain the correct number of Pods running?,ReplicationController,00d3fcb5
Why is ReplicationController no longer recommended in Kubernetes?,ReplicationController,00d3fcb5
What is a PriorityClass in Kubernetes and why is it important for scheduling Pods?,PriorityClass,69653f1f
"How does a PriorityClass map a name to an integer priority, and what fields are used to specify these?",PriorityClass,69653f1f
"What is the range of integer values for priority, and what does a higher value indicate in terms of priority?",PriorityClass,69653f1f
"Is a PriorityClass a namespaced object or not, and what does that imply?",PriorityClass,69653f1f
Where can the name of a PriorityClass be specified within its configuration?,PriorityClass,69653f1f
What is the primary purpose of FlexVolumes in Kubernetes?,FlexVolume,045efe41
Why does implementing FlexVolume drivers require root access?,FlexVolume,045efe41
What does the Storage SIG recommend as an alternative to FlexVolumes?,FlexVolume,045efe41
What are some potential limitations associated with FlexVolumes?,FlexVolume,045efe41
Where can users find more detailed information about FlexVolume usage and development?,FlexVolume,045efe41
What purpose does ensuring a copy of something running across multiple nodes serve?,DaemonSet,0d4eb61d
Why are system daemons like log collectors and monitoring agents deployed in this manner?,DaemonSet,0d4eb61d
What is typically required to run on every node according to the text?,DaemonSet,0d4eb61d
What are some contexts in which the term can have different meanings?,Developer (disambiguation),16492b66
Why is the term described as overloaded in the documentation?,Developer (disambiguation),16492b66
How should one approach understanding a term with multiple meanings in Kubernetes?,Developer (disambiguation),16492b66
What are feature gates in Kubernetes and what is their purpose?,Feature gate,1472974b
How can you enable or disable feature gates in a Kubernetes cluster?,Feature gate,1472974b
Are feature gates specific to each Kubernetes component or are they universal across all components?,Feature gate,1472974b
Where can you find a list of current feature gates and their functions in Kubernetes?,Feature gate,1472974b
What does the '--feature-gates' command line flag do in the context of Kubernetes components?,Feature gate,1472974b
What is the purpose of the operator pattern in Kubernetes?,Operator pattern,6833d8d1
How can Kubernetes be extended beyond its built-in controllers?,Operator pattern,6833d8d1
What role does a running application play in the operator pattern?,Operator pattern,6833d8d1
What is required for an application to be considered an example of the Operator pattern?,Operator pattern,6833d8d1
How does a controller perform tasks against a custom resource in Kubernetes?,Operator pattern,6833d8d1
What is the purpose of using the 'kubectl drain' command in a Kubernetes cluster?,Drain,0e37f131
How does 'kubectl drain' handle eviction requests that are temporarily rejected?,Drain,0e37f131
What happens to the pods on a node when 'kubectl drain' is executed?,Drain,0e37f131
What does it mean for a node to be marked as going out of service in Kubernetes?,Drain,0e37f131
"Is there a timeout for the 'kubectl drain' command, and what happens when it is reached?",Drain,0e37f131
What is the format of a URL that refers to a Kubernetes object?,Name,49ee3087
Can two objects of the same kind have the same name simultaneously?,Name,49ee3087
What happens if you delete an object with a specific name?,Name,49ee3087
Can you create a new object with the same name as a deleted object?,Name,49ee3087
What is the primary purpose of EndpointSlices in Kubernetes?,EndpointSlice,a900e810
Can EndpointSlices be manually configured even if they don't have specified selectors?,EndpointSlice,a900e810
How do EndpointSlices relate to the IP addresses of Pods?,EndpointSlice,a900e810
What is the purpose of namespaces in a Kubernetes cluster?,Namespace,b3ba0fe9
How does namespace-based scoping affect resource names in Kubernetes?,Namespace,b3ba0fe9
Which types of resources does namespace-based scoping apply to in Kubernetes?,Namespace,b3ba0fe9
Can you use namespaces to organize cluster-wide resources in Kubernetes?,Namespace,b3ba0fe9
Why do resource names need to be unique within a namespace?,Namespace,b3ba0fe9
What are ResourceSlices and what role do they play in dynamic resource allocation within a Kubernetes cluster?,ResourceSlice,70b67654
How does Kubernetes utilize ResourceSlices to allocate resources to a ResourceClaim?,ResourceSlice,70b67654
What happens when a is created in a Kubernetes cluster in terms of resource allocation and scheduling?,ResourceSlice,70b67654
Who or what is responsible for creating and managing ResourceSlices in a Kubernetes cluster?,ResourceSlice,70b67654
How do ResourceSlices contribute to the process of scheduling a Pod onto a node?,ResourceSlice,70b67654
What role do Helm charts play in managing Kubernetes applications?,Helm Chart,7d3f4658
How does a single Helm chart vary in terms of deployment complexity?,Helm Chart,7d3f4658
What are some examples of applications that can be deployed using a Helm chart?,Helm Chart,7d3f4658
What is a practical use of charts in the Kubernetes ecosystem?,Helm Chart,7d3f4658
How does Helm simplify the sharing of Kubernetes applications?,Helm Chart,7d3f4658
What factors determine the QoS Class assigned to a Pod in Kubernetes?,QoS Class,4e4fa3af
At what point is the QoS Class of a Pod determined?,QoS Class,4e4fa3af
What are the different QoS classes that Kubernetes can assign to a Pod?,QoS Class,4e4fa3af
How does Kubernetes use QoS classes in managing Pods?,QoS Class,4e4fa3af
What potential actions are influenced by a Pod's QoS Class in a Kubernetes cluster?,QoS Class,4e4fa3af
What is the purpose of a PodTemplate in Kubernetes?,PodTemplate,3f4dbf8b
How do workload management controllers use Pod templates?,PodTemplate,3f4dbf8b
In what situation would you have multiple Pods based on the same template?,PodTemplate,3f4dbf8b
Why might it be unnecessary to create a PodTemplate object directly?,PodTemplate,3f4dbf8b
What is the primary function of controllers in Kubernetes?,Controller,9bbf3737
How do controllers in Kubernetes monitor the state of the cluster?,Controller,9bbf3737
Which components are examples of controllers that run inside the control plane in Kubernetes?,Controller,9bbf3737
What is the relationship between the desired state and the current state in the context of Kubernetes controllers?,Controller,9bbf3737
Why are control loops crucial to the operations of Kubernetes?,Controller,9bbf3737
What fundamental hardware facilities do computers provide as resources in Kubernetes?,Resource (infrastructure),6df90e80
How does Kubernetes abstract resources for allocation to workloads?,Resource (infrastructure),6df90e80
What does Kubernetes utilize to manage resource consumption on nodes?,Resource (infrastructure),6df90e80
What is the purpose of dynamic resource allocation in Kubernetes?,Resource (infrastructure),6df90e80
What is the main purpose of the tool mentioned in the text?,Kubeadm,e1e3ce5e
What can kubeadm install in a Kubernetes setup?,Kubeadm,e1e3ce5e
How does the tool contribute to the security of a Kubernetes cluster?,Kubeadm,e1e3ce5e
What role does Istio play in managing traffic and integrating microservices?,Istio,82f0dea4
How does Istio's position in the network affect application code?,Istio,82f0dea4
What does the term 'service mesh' refer to in the context of Istio?,Istio,82f0dea4
How does Istio's control plane interact with different cluster management platforms like Kubernetes?,Istio,82f0dea4
What are the primary functions Istio provides in terms of policy enforcement and telemetry data aggregation?,Istio,82f0dea4
What operating systems can containerd run on as a daemon?,containerd,34c54dce
What are some of the main functions of containerd?,containerd,34c54dce
How does containerd handle container images?,containerd,34c54dce
What is the purpose of the agent that runs on each node in the Kubernetes cluster?,Kubelet,fd0bc66f
How does the kubelet ensure that the containers described in PodSpecs remain healthy?,Kubelet,fd0bc66f
Through what means does the kubelet receive the PodSpecs?,Kubelet,fd0bc66f
Does the kubelet manage containers that were not initiated by Kubernetes?,Kubelet,fd0bc66f
What is the consequence if a container was not created by Kubernetes in terms of management by the kubelet?,Kubelet,fd0bc66f
What types of cluster resources does Kubernetes garbage collection clean up?,Garbage Collection,3cd533ca
How does Kubernetes handle unused containers and images during garbage collection?,Garbage Collection,3cd533ca
What happens to failed Pods under the Kubernetes garbage collection process?,Garbage Collection,3cd533ca
How does Kubernetes manage completed Jobs through garbage collection?,Garbage Collection,3cd533ca
What role does the concept of ownership play in Kubernetes garbage collection?,Garbage Collection,3cd533ca
What advantage does dynamic provisioning offer to cluster administrators regarding storage management?,Dynamic Volume Provisioning,fd3f34cc
How does dynamic provisioning of storage work in Kubernetes?,Dynamic Volume Provisioning,fd3f34cc
What is the role of the API object in dynamic volume provisioning?,Dynamic Volume Provisioning,fd3f34cc
What is the primary function of cAdvisor in Kubernetes?,cAdvisor,6dd9ec20
How does cAdvisor collect and manage data for each container?,cAdvisor,6dd9ec20
What specific types of information does cAdvisor keep track of for containers?,cAdvisor,6dd9ec20
Does cAdvisor provide data on a machine-wide level or only at the container level?,cAdvisor,6dd9ec20
What kind of historical data does cAdvisor maintain for containers?,cAdvisor,6dd9ec20
What role do objects play in the Kubernetes API system?,Object,49703179
How does a Kubernetes object reflect a user's desired state for a cluster?,Object,49703179
What does Kubernetes do to maintain the state represented by an object after it's created?,Object,49703179
In what way does creating a Kubernetes object communicate with the system?,Object,49703179
Why is a Kubernetes object described as a 'record of intent'?,Object,49703179
What is the purpose of adding an ephemeral container to a Pod?,Ephemeral Container,42d83b79
Why are ephemeral containers not suitable for running part of the main workload?,Ephemeral Container,42d83b79
What limitations do ephemeral containers have in terms of scheduling and guarantees?,Ephemeral Container,42d83b79
Under what circumstances might one use an ephemeral container in Kubernetes?,Ephemeral Container,42d83b79
Are there any Kubernetes environments where ephemeral containers are not supported?,Ephemeral Container,42d83b79
What is the main function of a Volume Plugin in Kubernetes?,Volume Plugin,5e80cac9
What are the two types of volume plugins mentioned in the text?,Volume Plugin,5e80cac9
How do in tree volume plugins differ from out of tree plugins in terms of development and release cycle?,Volume Plugin,5e80cac9
What is the purpose of a ResourceClaimTemplate in Kubernetes?,ResourceClaimTemplate,0794e996
How does Kubernetes use ResourceClaimTemplates in dynamic resource allocation?,ResourceClaimTemplate,0794e996
What happens to a ResourceClaim object when the associated Pod terminates in Kubernetes?,ResourceClaimTemplate,0794e996
"How does Kubernetes ensure that each Pod accesses a separate, similar resource using ResourceClaimTemplates?",ResourceClaimTemplate,0794e996
In what scenario does Kubernetes automatically create ResourceClaim objects based on a template?,ResourceClaimTemplate,0794e996
What is the purpose of a manifest in Kubernetes?,Manifest,76c3e002
In what formats can a Kubernetes API object be specified?,Manifest,76c3e002
How many manifests can a single YAML file contain in Kubernetes?,Manifest,76c3e002
What role do finalizers play in the deletion process of Kubernetes objects?,Finalizer,d98b2083
How does Kubernetes indicate that an object is marked for deletion when it has finalizers?,Finalizer,d98b2083
What happens to an object in Kubernetes after the finalizers' conditions are met?,Finalizer,d98b2083
How can finalizers be used to manage resource deletion in Kubernetes?,Finalizer,d98b2083
What status code does Kubernetes return when a delete request is accepted for an object with finalizers?,Finalizer,d98b2083
What is the primary function of a cgroup in Linux?,cgroup (control group),f853338c
Which resources can be managed by a cgroup?,cgroup (control group),f853338c
How does a cgroup differ from individual process management in Linux?,cgroup (control group),f853338c
What does an API object do in Kubernetes with regards to managing applications?,Deployment,ea355214
How are replicas represented and distributed in a Kubernetes cluster?,Deployment,ea355214
What should you consider using if your application workloads require local state?,Deployment,ea355214
What is the purpose of certificates within a Kubernetes cluster?,Certificate,eb0f48a1
How do certificates ensure secure access to the Kubernetes API?,Certificate,eb0f48a1
Why is it necessary for applications inside the cluster to have validated certificates?,Certificate,eb0f48a1
What is the main purpose of Kubernetes in the context of containerized applications?,Glossary,31d109d1
How does Kubernetes ensure that containerized applications are deployed and managed consistently across different environments?,Glossary,31d109d1
What role do Kubernetes objects play in the management of an application's lifecycle?,Glossary,31d109d1
How does Kubernetes handle scaling of applications to accommodate varying loads?,Glossary,31d109d1
What are some benefits of using Kubernetes for managing microservices architectures?,Glossary,31d109d1
What is the purpose of working groups within the Kubernetes community?,WG (working group),f1f911cd
How do working groups differ from long-term organizational structures in Kubernetes?,WG (working group),f1f911cd
Where can I find more details about the existing working groups and SIGs in Kubernetes?,WG (working group),f1f911cd
What are logs used for in a Kubernetes cluster?,Logging,8db7df66
How can logs assist in debugging within a Kubernetes environment?,Logging,8db7df66
Why are logs important for monitoring activities in a cluster?,Logging,8db7df66
What types of logs can be found in a Kubernetes cluster?,Logging,8db7df66
How do logs contribute to understanding cluster events?,Logging,8db7df66
What is the purpose of a Contributor License Agreement (CLA) in the context of open source projects?,CLA (Contributor License Agreement),0ed59e46
How do CLAs assist in addressing potential legal issues related to contributions?,CLA (Contributor License Agreement),0ed59e46
In what way do CLAs relate to intellectual property in open source projects?,CLA (Contributor License Agreement),0ed59e46
What are some components that the infrastructure layer is responsible for in Kubernetes?,Cluster Infrastructure,b2f3b4e2
How does the infrastructure layer contribute to networking in a Kubernetes environment?,Cluster Infrastructure,b2f3b4e2
In what way does the infrastructure layer enhance security within Kubernetes?,Cluster Infrastructure,b2f3b4e2
What are the three essential properties of a core object related to scheduling in Kubernetes?,Taint,0f13555d
How do taints and tolerations function together to manage pod scheduling on nodes?,Taint,0f13555d
Why are taints applied to nodes in Kubernetes?,Taint,0f13555d
What is meant by a 'Managed Service' in the context of software offerings?,Managed Service,b083d43e
Can you give some examples of Managed Services provided by third-party providers?,Managed Service,b083d43e
"Are Managed Services limited to certain types of software, or can they be any software offering?",Managed Service,b083d43e
What is a static pod in Kubernetes and how is it managed?,Static Pod,18b35c41
How does the API server interact with static pods in Kubernetes?,Static Pod,18b35c41
What features or functionalities are not supported by static pods?,Static Pod,18b35c41
How does a StatefulSet ensure that each Pod maintains a unique identity even if rescheduled?,StatefulSet,f202d113
What is one advantage of using a StatefulSet when dealing with persistent storage volumes?,StatefulSet,f202d113
In what way does a StatefulSet differ from a Deployment in managing Pods?,StatefulSet,f202d113
Why might StatefulSet be a preferred choice when a sticky identity for Pods is required?,StatefulSet,f202d113
What is the primary function of a ResourceQuota in a Kubernetes namespace?,ResourceQuota,0b79951d
How does a ResourceQuota limit the creation of resources by type within a namespace?,ResourceQuota,0b79951d
In what way can a ResourceQuota manage overall resource consumption in a namespace?,ResourceQuota,0b79951d
What are user namespaces in the context of the Linux kernel?,user namespace,a1b02114
How do user namespaces help enhance container security?,user namespace,a1b02114
What distinction is made between namespaces in Linux and Kubernetes with regards to user namespaces?,user namespace,a1b02114
Why might a user choose to use user namespaces when running containers?,user namespace,a1b02114
How do user namespaces mitigate the risks of potential container break-out attacks?,user namespace,a1b02114
What is the main function of an init container in a Kubernetes pod?,Init Container,e02d70c6
How do init containers differ in execution order compared to regular app containers?,Init Container,e02d70c6
Do init containers stay running after the Pod has started?,Init Container,e02d70c6
Where can I find more detailed information about init containers in Kubernetes?,Init Container,e02d70c6
What is the purpose of the Gateway API in Kubernetes?,Gateway API,5c5ec427
How does the Gateway API differ from other API kinds in Kubernetes?,Gateway API,5c5ec427
What features make the Gateway API protocol-aware?,Gateway API,5c5ec427
How does the Gateway API support the different roles?,Gateway API,5c5ec427
In what aspect is the Gateway API described as extensible?,Gateway API,5c5ec427
What is the purpose of events in a Kubernetes cluster?,Event,a4ecfc70
Why should event consumers not depend on the timing or consistency of events?,Event,a4ecfc70
How does Kubernetes auditing differ from regular events?,Event,a4ecfc70
What is the recommended way to use events in Kubernetes?,Event,a4ecfc70
What is the retention policy for events in Kubernetes clusters?,Event,a4ecfc70
What is the purpose of using key-value pairs in Kubernetes annotations?,Annotation,55f6611c
What kind of data can be included in Kubernetes annotations?,Annotation,55f6611c
Who can access the metadata stored in Kubernetes annotations?,Annotation,55f6611c
Are there any restrictions on the size or format of data in Kubernetes annotations?,Annotation,55f6611c
Can characters that are usually not permitted be included in the metadata of Kubernetes annotations?,Annotation,55f6611c
What is the role of the Eviction API in the process of API-initiated eviction?,API-initiated eviction,602253aa
How can you request an eviction using the kube-apiserver?,API-initiated eviction,602253aa
What are two factors that API-initiated evictions take into account when terminating a pod?,API-initiated eviction,602253aa
How does API-initiated eviction differ from node-pressure eviction?,API-initiated eviction,602253aa
What is the purpose of a Service in a Kubernetes cluster?,Service,c2ba7e78
How does a Service determine which Pods to target?,Service,c2ba7e78
What happens to the network traffic when the set of Pods changes?,Service,c2ba7e78
What networking methods can Kubernetes Services use?,Service,c2ba7e78
How does the Service abstraction relate to mechanisms like Ingress and Gateway?,Service,c2ba7e78
What is the purpose of the 'securityContext' field in Kubernetes?,Security Context,1ac90aa9
Can you list some specific configurations you can define in a 'securityContext'?,Security Context,1ac90aa9
How does the 'PodSpec.securityContext' setting affect containers within a pod?,Security Context,1ac90aa9
What are some examples of security policies that can be configured in a 'securityContext'?,Security Context,1ac90aa9
Does the 'securityContext' allow for setting the user and group for running processes?,Security Context,1ac90aa9
What is the main purpose of eviction in Kubernetes?,Eviction,ac22e8a2
How many types of eviction are there in Kubernetes?,Eviction,ac22e8a2
What are the two kinds of eviction mentioned in the Kubernetes documentation?,Eviction,ac22e8a2
What is Minikube used for in the context of Kubernetes?,Minikube,43840b13
How does Minikube run a local Kubernetes cluster on your computer?,Minikube,43840b13
In what kind of environment can you use Minikube to try Kubernetes?,Minikube,43840b13
What are the two nested object fields that govern the configuration of a Kubernetes object?,Spec,85a2ca75
"When configuring the 'spec' field of a Kubernetes object, what information must be provided?",Spec,85a2ca75
"How does the 'spec' field differ among various Kubernetes objects like Pods, StatefulSets, and Services?",Spec,85a2ca75
What kind of settings are included in a Kubernetes object's 'spec' field for it to reach its desired state?,Spec,85a2ca75
How does Kubernetes use the 'spec' field to maintain the state of an object?,Spec,85a2ca75
What role does a cluster architect play in designing Kubernetes infrastructure?,Cluster Architect,09a35c88
What best practices do cluster architects focus on concerning distributed systems?,Cluster Architect,09a35c88
How does high availability factor into the responsibilities of a cluster architect?,Cluster Architect,09a35c88
In what ways do cluster architects ensure security within Kubernetes clusters?,Cluster Architect,09a35c88
Why might multiple Kubernetes clusters be deployed in a single infrastructure design?,Cluster Architect,09a35c88
What is a core function of Kubernetes in relation to container management?,Container Runtime,9a3ee949
Which container runtimes are compatible with Kubernetes?,Container Runtime,9a3ee949
What interface standard does Kubernetes rely on for container runtime implementations?,Container Runtime,9a3ee949
What is the difference between a Role and a ClusterRole in Kubernetes?,RBAC (Role-Based Access Control),b530205f
How does a RoleBinding differ from a ClusterRoleBinding in terms of scope and permissions?,RBAC (Role-Based Access Control),b530205f
What kinds of objects are used by RBAC to manage permissions in Kubernetes?,RBAC (Role-Based Access Control),b530205f
Can a Role be used to define permissions that apply across an entire Kubernetes cluster?,RBAC (Role-Based Access Control),b530205f
How can administrators dynamically configure access policies in Kubernetes?,RBAC (Role-Based Access Control),b530205f
What is the purpose of affinity in Kubernetes?,Affinity,ef5508a7
What are the two types of affinity mentioned in the text?,Affinity,ef5508a7
How does node affinity differ from pod-to-pod affinity?,Affinity,ef5508a7
What determines whether the affinity rules are required or preferred?,Affinity,ef5508a7
How does the scheduler use the affinity rules to decide pod placement?,Affinity,ef5508a7
What was the role of the deprecated Kubernetes API known as PodSecurityPolicy?,Pod Security Policy,686b0c46
In which version of Kubernetes was PodSecurityPolicy removed?,Pod Security Policy,686b0c46
What can be used as alternatives to PodSecurityPolicy after its removal in Kubernetes?,Pod Security Policy,686b0c46
When was PodSecurityPolicy deprecated in Kubernetes?,Pod Security Policy,686b0c46
What is Pod Security Admission in the context of Kubernetes?,Pod Security Policy,686b0c46
What is the main purpose of setting a Pod Disruption Budget in Kubernetes?,Pod Disruption Budget,fad51769
How does a Pod Disruption Budget impact voluntary pod evictions?,Pod Disruption Budget,fad51769
Can Pod Disruption Budgets prevent involuntary disruptions to pods?,Pod Disruption Budget,fad51769
Do involuntary pod disruptions affect the limits set by a Pod Disruption Budget?,Pod Disruption Budget,fad51769
What is the main purpose of a ReplicaSet in a Kubernetes cluster?,ReplicaSet,3f402161
How do workload objects utilize ReplicaSets in a Kubernetes environment?,ReplicaSet,3f402161
What does a ReplicaSet aim to ensure within a cluster according to its specifications?,ReplicaSet,3f402161
What is the primary role of a Pod in Kubernetes?,Pod,8a0813c7
How many primary containers does a Pod typically run?,Pod,8a0813c7
What additional features can sidecar containers provide in a Pod?,Pod,8a0813c7
