question,title,document
Who usually manages Pods within a Kubernetes environment?,Pod,8a0813c7
What is the purpose of having multiple replicas of a pod in a Kubernetes cluster?,Replica,f8ef73dd
How does defining the number of replicas in a Deployment or ReplicaSet affect a Kubernetes cluster?,Replica,f8ef73dd
What benefits do replicas provide in terms of application availability and scalability?,Replica,f8ef73dd
In what ways do replicas contribute to the load balancing and update processes in Kubernetes?,Replica,f8ef73dd
How does Kubernetes handle a situation where the number of running instances differs from the specified number of replicas?,Replica,f8ef73dd
What does a resource represent in the Kubernetes type system?,API resource,0719b5ff
How is an operation on objects depicted in Kubernetes resources?,API resource,0719b5ff
What does each resource signify on the Kubernetes API server?,API resource,0719b5ff
How is the schema for objects or operations defined in the Kubernetes API server resources?,API resource,0719b5ff
What activities can members participate in through GitHub teams in the Kubernetes community?,Member,858ba476
What happens to a member's pull requests in terms of testing procedures?,Member,858ba476
What is expected of a member in the Kubernetes community in terms of contribution?,Member,858ba476
What is the primary function of the Kubernetes cloud controller manager?,Cloud Controller Manager,4629cd57
How does the cloud controller manager benefit the development pace between cloud providers and the Kubernetes project?,Cloud Controller Manager,4629cd57
What is the role of the cloud controller manager in managing components that interact with cloud platforms versus cluster-only components?,Cloud Controller Manager,4629cd57
What technology does Docker Engine use to achieve operating-system-level virtualization?,Docker,c5fd214c
Which Linux kernel features are utilized by Docker for resource isolation?,Docker,c5fd214c
How does Docker differ from traditional virtual machines in terms of resource management and overhead?,Docker,c5fd214c
What is a workload in the context of Kubernetes?,Workload,68eaabb9
What are some core objects in Kubernetes related to workloads?,Workload,68eaabb9
Can you give an example of how different parts of a workload might be distributed in Kubernetes?,Workload,68eaabb9
What is the purpose of using CEL in Kubernetes?,Common Expression Language,7b3b419f
How can CEL expressions be utilized with dynamic admission control in Kubernetes?,Common Expression Language,7b3b419f
In what way can CEL be applied to dynamic resource allocation in Kubernetes?,Common Expression Language,7b3b419f
What resources are essential for running containers within Kubernetes?,Data Plane,19ee64a7
How do containers connect to a network in Kubernetes?,Data Plane,19ee64a7
"What is the role of the layer that provides CPU, memory, network, and storage capacities?",Data Plane,19ee64a7
What is the role of a service account when processes inside Pods access the cluster?,ServiceAccount,5c24ffd6
What happens if you do not specify a service account when creating a Pod?,ServiceAccount,5c24ffd6
What service account is automatically assigned to a Pod if none is specified during its creation?,ServiceAccount,5c24ffd6
What does a Job in Kubernetes do?,Job,cf51066f
How does a Job ensure the specified number of Pods successfully complete?,Job,cf51066f
What does the Job do as Pods complete their tasks?,Job,cf51066f
What are Group Version Resources (GVRs) used for in Kubernetes?,Group Version Resource,90223ebe
How do GVRs help when APIs change?,Group Version Resource,90223ebe
What does the term 'resource' refer to in the context of GVRs?,Group Version Resource,90223ebe
Why might a GVR not refer to a specific namespace?,Group Version Resource,90223ebe
How do GVRs contribute to distinguishing different Kubernetes objects?,Group Version Resource,90223ebe
What role does a proxy server play in communication between a client and a remote service in computing?,Proxy,f56ec2ab
How does kube-proxy function as part of a Kubernetes cluster?,Proxy,f56ec2ab
What are the two modes kube-proxy can operate in and how do they differ in terms of resource usage?,Proxy,f56ec2ab
Why might someone choose to run kube-proxy in hybrid mode if their operating system supports it?,Proxy,f56ec2ab
"How does the communication process work between a client, proxy, and actual server?",Proxy,f56ec2ab
What is the role of the control plane component in scheduling newly created pods in Kubernetes?,kube-scheduler,81e0da1d
What are the factors considered when making scheduling decisions for pods in Kubernetes?,kube-scheduler,81e0da1d
How do affinity and anti-affinity specifications influence the scheduling of pods?,kube-scheduler,81e0da1d
In what ways does data locality impact the scheduling decisions in Kubernetes?,kube-scheduler,81e0da1d
Why might deadlines be an important factor in the scheduling process for Kubernetes workloads?,kube-scheduler,81e0da1d
What is the main purpose of an Ingress in Kubernetes?,Ingress,7d05c708
What functionalities can an Ingress offer in a Kubernetes cluster?,Ingress,7d05c708
Does an Ingress handle SSL termination for services in a Kubernetes cluster?,Ingress,7d05c708
Can an Ingress object provide virtual hosting features for a cluster?,Ingress,7d05c708
How does an Ingress relate to load balancing in Kubernetes?,Ingress,7d05c708
What aspects do approvers consider for the holistic acceptance of a Kubernetes code contribution?,Approver,8ac45c9b
How does the role of an approver differ from a code reviewer in the context of Kubernetes?,Approver,8ac45c9b
What was the previous title used for someone with approver status in Kubernetes?,Approver,8ac45c9b
To what extent is an approver's authority limited within the Kubernetes codebase?,Approver,8ac45c9b
What are Kubernetes add-ons and how do they enhance a cluster's functionality?,Add-ons,2ed9fe33
Where can I find more information about installing add-ons in Kubernetes?,Add-ons,2ed9fe33
What type of content would I expect to find in the Kubernetes documentation about add-ons?,Add-ons,2ed9fe33
What types of devices might be attached to a Kubernetes cluster?,Device,e0ac20ad
Why do attached devices usually require device drivers in Kubernetes?,Device,e0ac20ad
What is an example of custom hardware that could be attached to a Kubernetes environment?,Device,e0ac20ad
What are lifecycle hooks in Kubernetes and what purpose do they serve?,Container Lifecycle Hooks,73951e7d
What is the PostStart hook and when does it execute?,Container Lifecycle Hooks,73951e7d
How does the PreStop hook function and when is it triggered?,Container Lifecycle Hooks,73951e7d
Are lifecycle hooks associated with a specific part of container management?,Container Lifecycle Hooks,73951e7d
What is the main difference in the timing of execution between PostStart and PreStop hooks?,Container Lifecycle Hooks,73951e7d
What actions does the kubelet take when it discovers a static pod in its configuration?,Mirror Pod,e67ee101
How is a mirror pod related to the Kubernetes API server once created by the kubelet?,Mirror Pod,e67ee101
What effect does removing a mirror pod from the API server have on the kubelet's operation?,Mirror Pod,e67ee101
What is the role of application containers in the context of a pod?,App Container,45f2864b
Why might someone use an init container in a pod configuration?,App Container,45f2864b
"If a pod lacks init containers, what type of containers does it contain?",App Container,45f2864b
What does the duration format in Kubernetes represent and where is it derived from?,Duration,e02d2ae0
"How are Kubernetes durations expressed in the API, and what is their structure?",Duration,e02d2ae0
What are the valid time units you can use when specifying a duration in Kubernetes?,Duration,e02d2ae0
"Can a Kubernetes duration consist of multiple time quantities, and how are these quantities interpreted?",Duration,e02d2ae0
Could you give an example of how a duration might be formatted in Kubernetes?,Duration,e02d2ae0
How can you modify the activation status of an API group in Kubernetes?,API Group,2768dcc5
What is the purpose of having API groups within the Kubernetes API?,API Group,2768dcc5
Where can you find more detailed information on API groups and versioning in Kubernetes?,API Group,2768dcc5
What is the purpose of using selectors in Kubernetes?,Selector,0c3cd33e
How do selectors help when querying lists of resources in Kubernetes?,Selector,0c3cd33e
What role do labels play in the use of selectors for filtering resources?,Selector,0c3cd33e
What is the purpose of using CIDR in Kubernetes networking?,CIDR,fb34bfeb
How does CIDR facilitate IP address allocation in Kubernetes?,CIDR,fb34bfeb
Is CIDR applicable to both IPv4 and IPv6 in Kubernetes?,CIDR,fb34bfeb
What role does a subnet mask play in CIDR notation within Kubernetes?,CIDR,fb34bfeb
What is the primary protocol used by Kubernetes for communication with the Container Runtime?,Container Runtime Interface (CRI),6a621a1c
Which interface defines the gRPC protocol used for communication between node components and the Container Runtime in Kubernetes?,Container Runtime Interface (CRI),6a621a1c
Where can I find more details about node components in the Kubernetes architecture?,Container Runtime Interface (CRI),6a621a1c
What is the purpose of the Container Storage Interface (CSI) in Kubernetes?,Container Storage Interface (CSI),e7862e4a
How do custom storage plugins differ from traditional plugins in Kubernetes in terms of integration?,Container Storage Interface (CSI),e7862e4a
What is a necessary step before utilizing a CSI driver from a storage provider in a Kubernetes cluster?,Container Storage Interface (CSI),e7862e4a
Where can you find more detailed information on specific CSI drivers available for use with Kubernetes?,Container Storage Interface (CSI),e7862e4a
What is the purpose of the layer mentioned in the context of Kubernetes?,Applications,1ddf333c
What types of applications operate within this layer?,Applications,1ddf333c
How are the applications described in the text prepared for operation in this layer?,Applications,1ddf333c
What are the main components included in a StorageClass that help manage storage types?,Storage Class,8d89aed0
How can users request a specific storage type in Kubernetes?,Storage Class,8d89aed0
"What roles do 'provisioner', 'parameters', and 'reclaimPolicy' fields play in a StorageClass?",Storage Class,8d89aed0
What is the main purpose of a SIG in Kubernetes?,SIG (special interest group),bf5a3ef1
How do SIGs maintain governance within their groups?,SIG (special interest group),bf5a3ef1
Where can I find a list of current SIGs and Working Groups in Kubernetes?,SIG (special interest group),bf5a3ef1
What interests might members of a SIG share?,SIG (special interest group),bf5a3ef1
Can SIGs have their own methods of contribution and communication apart from the governance guidelines?,SIG (special interest group),bf5a3ef1
What is the primary purpose of a PersistentVolume in a Kubernetes cluster?,Persistent Volume,dc169184
How do PersistentVolumes abstract the details of storage provision and consumption?,Persistent Volume,dc169184
When would you use PersistentVolumeClaims instead of directly using PersistentVolumes?,Persistent Volume,dc169184
What are the differences between static provisioning and dynamic provisioning in the context of Kubernetes storage?,Persistent Volume,dc169184
What command can you use to list all images running in a Kubernetes cluster across all namespaces?,kubectl Quick Reference,03465c70
How can you retrieve the names and images of all pods specifically in the 'default' namespace?,kubectl Quick Reference,03465c70
"What is the correct command to list all images in a cluster, excluding a specific image named 'registry.k8s.io/coredns:1.6.2'?",kubectl Quick Reference,03465c70
"How would you display all metadata fields for pods in every namespace, regardless of their specific names?",kubectl Quick Reference,03465c70
What is the purpose of using the '-o=jsonpath' option in 'kubectl get pods'?,JSONPath Support,cdac89d1
How would you retrieve only the name of the first pod using the jsonpath option?,JSONPath Support,cdac89d1
"If you wanted to get the metadata name and status capacity of all pods, what would the jsonpath query look like?",JSONPath Support,cdac89d1
"In a Windows environment, how should a JSONPath template with spaces be quoted in a 'kubectl' command?",JSONPath Support,cdac89d1
What is the difference in output when getting pod information with '-o json' compared to '-o=jsonpath'?,JSONPath Support,cdac89d1
What are the main components of a Kubernetes cluster?,kubectl Commands,aecc7cc0
How does Kubernetes ensure that applications are running as desired?,kubectl Commands,aecc7cc0
What role do nodes play in a Kubernetes environment?,kubectl Commands,aecc7cc0
Can you explain the concept of a pod in Kubernetes?,kubectl Commands,aecc7cc0
How does Kubernetes handle scaling of applications?,kubectl Commands,aecc7cc0
What is the primary function of the kubectl command?,kubectl,0f12ee5c
Where can I find more detailed information about the kubectl tool?,kubectl,0f12ee5c
What is the basic syntax for using kubectl with flags?,kubectl,0f12ee5c
What are the main components of a Kubernetes cluster?,Introduction to kubectl,96890108
How does a Kubernetes Pod differ from a Node?,Introduction to kubectl,96890108
What role does the API server play in a Kubernetes cluster?,Introduction to kubectl,96890108
What is the primary purpose of Kubernetes in managing containerized applications?,Kubectl user preferences (kuberc),8789a9d4
How does Kubernetes ensure high availability for applications?,Kubectl user preferences (kuberc),8789a9d4
Can you explain the role of a pod within Kubernetes?,Kubectl user preferences (kuberc),8789a9d4
What mechanisms does Kubernetes use to scale applications automatically?,Kubectl user preferences (kuberc),8789a9d4
How does Kubernetes handle resource allocation for different applications?,Kubectl user preferences (kuberc),8789a9d4
What are the basic components of a Kubernetes cluster?,kubectl reference,58e490dc
How does Kubernetes manage containerized applications across a cluster?,kubectl reference,58e490dc
What role does the Kubernetes API server play in the cluster architecture?,kubectl reference,58e490dc
Can you explain how Kubernetes uses controllers and schedulers?,kubectl reference,58e490dc
What is the purpose of a pod in Kubernetes?,kubectl reference,58e490dc
What command would you use to update the service account in a cluster role binding?,kubectl set subject,19ee0bd4
How can you update a role binding to include multiple users and a group?,kubectl set subject,19ee0bd4
What does the --dry-run=client option do when updating rolebinding subjects?,kubectl set subject,19ee0bd4
What happens to an existing selector on a resource when a new selector is set?,kubectl set selector,ac37f03f
What are the character and length requirements for setting a selector?,kubectl set selector,ac37f03f
Which resource type currently supports setting selectors with this method?,kubectl set selector,ac37f03f
How does specifying the --resource-version affect the update process for selectors?,kubectl set selector,ac37f03f
"In the provided example, what purpose does the --dry-run=client option serve?",kubectl set selector,ac37f03f
What are the possible resources where environment variables can be managed in Kubernetes?,kubectl set env,33c47c3e
How can you update the environment variables of a specific deployment to include a new key-value pair?,kubectl set env,33c47c3e
What command would you use to list all environment variables for a specific deployment?,kubectl set env,33c47c3e
How can environment variables be imported from a config map with a specified prefix using kubectl?,kubectl set env,33c47c3e
What is the command to remove an environment variable from all deployment configurations while targeting a specific container?,kubectl set env,33c47c3e
What command is used to update the service account of a deployment?,kubectl set serviceaccount,6a49db46
Which resources can have their service account updated using the given command?,kubectl set serviceaccount,6a49db46
How can you simulate updating a deployment's service account without sending the command to the API server?,kubectl set serviceaccount,6a49db46
What happens if a request is not specified for a compute resource like CPU or memory?,kubectl set resources,4ee82c41
How can you set both limits and requests for CPU and memory on a deployment's container using kubectl?,kubectl set resources,4ee82c41
What command would you use to remove resource requests for a deployment's containers?,kubectl set resources,4ee82c41
How can you update resource limits for a container in a YAML file locally without applying changes to the server?,kubectl set resources,4ee82c41
What Kubernetes command would you use to update the image of a specific container in a deployment to a new version?,kubectl set image,3576381d
How can you update the image of all containers in a specific daemonset to a specified image?,kubectl set image,3576381d
Which flag would allow you to update the container image from a file without connecting to the server?,kubectl set image,3576381d
"Can you update multiple resource types, like deployments and replication controllers, at the same time using a single command?",kubectl set image,3576381d
Is it possible to specify multiple containers and their respective images in one command when updating a resource?,kubectl set image,3576381d
What is the purpose of the 'kubectl set' command in Kubernetes?,kubectl set,ea602a47
How does the 'kubectl set SUBCOMMAND' syntax help in managing application resources?,kubectl set,ea602a47
What type of changes can be made to application resources using 'kubectl set'?,kubectl set,ea602a47
What command would you use to start a pod with a specific name and image?,kubectl run,647cbc0a
How can you expose a specific port on a pod using the kubectl run command?,kubectl run,647cbc0a
What is the purpose of using the --dry-run option when running a pod?,kubectl run,647cbc0a
How do you set multiple environment variables when starting a pod with the kubectl run command?,kubectl run,647cbc0a
What does the --overrides option achieve when starting a pod?,kubectl run,647cbc0a
What command can be used to print all supported API resources on a Kubernetes server?,kubectl api-resources,b703bead
How can you print the supported API resources along with additional details?,kubectl api-resources,b703bead
Which command would you use to sort the list of supported API resources by name?,kubectl api-resources,b703bead
How do you display only the API resources that are namespaced?,kubectl api-resources,b703bead
"How can you list API resources from a specific API group, such as 'rbac.authorization.k8s.io'?",kubectl api-resources,b703bead
What are annotations in Kubernetes and how do they differ from labels?,kubectl annotate,3b9fa335
What happens if I try to add an annotation that already exists and how can it be resolved?,kubectl annotate,3b9fa335
How can you update an annotation on multiple Kubernetes resources at once?,kubectl annotate,3b9fa335
What is the purpose of the --resource-version flag in the context of modifying annotations?,kubectl annotate,3b9fa335
How do you remove an annotation from a Kubernetes resource?,kubectl annotate,3b9fa335
What is the default output destination when running the 'kubectl cluster-info dump' command without specifying an output directory?,kubectl cluster-info dump,9ce0785e
"How can you include log data for pods in the cluster information dump, and where are these logs organized?",kubectl cluster-info dump,9ce0785e
Which flag would you use if you want to include information from all namespaces in the cluster dump?,kubectl cluster-info dump,9ce0785e
How can you specify a particular directory location to save the cluster dump files?,kubectl cluster-info dump,9ce0785e
"If you need to dump information from specific namespaces only, which flag allows you to do that?",kubectl cluster-info dump,9ce0785e
What command is used to display the addresses of the control plane and services in Kubernetes?,kubectl cluster-info,7e05cfcc
Which label is associated with the services whose addresses are displayed by the 'kubectl cluster-info' command?,kubectl cluster-info,7e05cfcc
What command can be used to debug and diagnose cluster issues in Kubernetes?,kubectl cluster-info,7e05cfcc
"In the context of 'kubectl cluster-info', what is the purpose of using flags?",kubectl cluster-info,7e05cfcc
What type of information does 'kubectl cluster-info' output provide?,kubectl cluster-info,7e05cfcc
What is the purpose of the 'kubectl explain' command in Kubernetes?,kubectl explain,25a6e17a
How can you retrieve information about all fields of a resource using 'kubectl explain'?,kubectl explain,25a6e17a
What does the API version parameter do in the 'kubectl explain' command?,kubectl explain,25a6e17a
How is information about each field retrieved and formatted from the server?,kubectl explain,25a6e17a
What command would you use to get the explanation of a specific field within a Kubernetes resource?,kubectl explain,25a6e17a
How can you describe resources in Kubernetes using their name prefix or label selector?,kubectl describe,53f41626
What is the command to get a detailed description of all resources of a particular type using kubectl?,kubectl describe,53f41626
"If you wanted to describe all pods created by a specific replication controller, which command would you use?",kubectl describe,53f41626
How does kubectl handle a request if there is no exact match for the TYPE and NAME_PREFIX provided?,kubectl describe,53f41626
What command can you use to describe a resource using a configuration file in Kubernetes?,kubectl describe,53f41626
What is the default editor used for editing resources if the KUBE_EDITOR or EDITOR environment variables are not set?,kubectl edit,890eaa78
How can you specify to edit a resource in JSON format instead of the default YAML?,kubectl edit,890eaa78
What should you do if another editor changes a resource on the server while you are editing it?,kubectl edit,890eaa78
"Can you edit multiple resources at once with the edit command, and how are changes applied in such cases?",kubectl edit,890eaa78
How can you specify to use Windows line endings when editing a resource?,kubectl edit,890eaa78
How can you retrieve logs from a pod that has multiple containers?,kubectl logs,66b92e95
What option should be used to stream logs from a pod and continue logging even if errors occur?,kubectl logs,66b92e95
How can you obtain logs from a specific pod but limit the log file size to a certain number of bytes?,kubectl logs,66b92e95
What command would you use to get logs from all containers in pods that have a specific label?,kubectl logs,66b92e95
How can you fetch logs from a job named 'hello'?,kubectl logs,66b92e95
What does the 'kubectl create namespace' command do in Kubernetes?,kubectl create namespace,e4221b52
How can you create a namespace called 'my-namespace' using kubectl?,kubectl create namespace,e4221b52
What options are available for the --dry-run flag when creating a namespace?,kubectl create namespace,e4221b52
How can you request a service account token for a specific namespace using kubectl?,kubectl create token,a0890912
What command would you use to get a token with a custom expiration time for a service account?,kubectl create token,a0890912
How can you request a token with a specific audience using the kubectl command?,kubectl create token,a0890912
"What is the purpose of binding a token to a Secret object, and how is it specified in the command?",kubectl create token,a0890912
How do you request a token bound to a Secret object with a specific UID?,kubectl create token,a0890912
What command would you use to create an ingress that directs all requests to '/path' to a specific service and specifies an Ingress Class?,kubectl create ingress,6ea305f1
How can you create an ingress that uses TLS with a specified secret and a path type of Prefix?,kubectl create ingress,6ea305f1
What is the command to create an ingress with multiple paths for the same host 'foo.com'?,kubectl create ingress,6ea305f1
How do you create an ingress with two specific annotations and a default Ingress Class?,kubectl create ingress,6ea305f1
In what way can you create a default backend for an ingress using the specified command syntax?,kubectl create ingress,6ea305f1
What command would you use to create a deployment named 'my-dep' that uses the busybox image and specifies a command to run?,kubectl create deployment,dd580d9f
How can you create a deployment with a specific number of replicas using the nginx image?,kubectl create deployment,dd580d9f
What is the command for creating a deployment that uses multiple container images?,kubectl create deployment,dd580d9f
"Is it possible to specify a port to be exposed when creating a deployment, and if so, how?",kubectl create deployment,dd580d9f
What are the basic requirements when using 'kubectl create deployment' to set up a deployment?,kubectl create deployment,dd580d9f
What is the purpose of using the command 'kubectl create service loadbalancer NAME' in Kubernetes?,kubectl create service loadbalancer,7646bf18
How do you specify the ports when creating a LoadBalancer service using kubectl?,kubectl create service loadbalancer,7646bf18
What is the effect of using the '--dry-run' flag when creating a LoadBalancer service?,kubectl create service loadbalancer,7646bf18
Can you provide an example of creating a LoadBalancer service with a specific name and port forwarding?,kubectl create service loadbalancer,7646bf18
What does the parameter '--tcp=port:targetPort' represent in the command to create a LoadBalancer service?,kubectl create service loadbalancer,7646bf18
